comment,value
sexy slut,neg
greate slut,neg
No homo but her ass is fucking awesome,neg
looks like she's wearing a condom!,neg
Go Beyonce And Her Friend Sumthin Big Brandon Would Neva An Will Neva Giv A Fuk About Duuuh!!,pos
That actually looks a bit uncomfortable,pos
My girl love you chica......,pos
Wow absolutely stunning cute butt,neg
Dat booty tho,neg
That ass nice,neg
Wow awesome,pos
That dress is fucking awesome,pos
Hot as alwyz,pos
My star i love u ,pos
Hi beyonce,neg
wish I cn touch them 1day,neg
sexy bathin suit love it wowwwwwwwwwwww,neg
Wow beyonce are sexy,pos
very nice and beautifu,pos
beyonce it's beautiful,pos
just move your body,neg
wow! you are so sexy!,neg
so good looking! ur really charming ! crazy in luv with u,pos
Queen B you driving those men crazy all over you,pos
I am Crazy about u,pos
wow girl what a lovey bathing suit and body,pos
love the bathing suit,pos
best pose....,pos
Hot as always,pos
i like this the pretty beyonce,pos
Hi Kim. You're looking great as always,pos
looking good but always with out shirt just a bra?,neg
The definition of 'CURVACIOUS'!!,pos
Very and very beautiful,pos
do you love me?,pos
DAMNNNNN,pos
Are you going to the sea ?!!,pos
I'm in love with her shape,neg
Gorgeous as always kim,pos
Hate the shoe,neg
go away vampire,neg
Stunning!,pos
So Beautiful Girl,pos
babe you look good!,pos
 I wanna lick her butthole and taste her caca mmmmm sexy and delicious,neg
Kim Kardashian is sexy bootylicious,neg
I love her booty.,neg
I would lick her butthole that's my sexy nasty fantasy with Kim,neg
Kim is way more beautiful than Beyonce,pos
Very pretty outfit Kim Kardashian god Bless you,pos
This woman is heaven for someone.,pos
First time I'm watching her in decent dress.,neg
Wow in every picture You Should Naked some place of Your body you have to change Tv Show I mean Keeping up with the kardashians to Naked with the Kardashians,neg
Hot looking,neg
Sexy boob,neg
?Tits & Nipples?,neg
So beautiful booty I love you too baby I miss you too jan,neg
Too hot,neg
Goddamn you are fucking absolutely stunningly gorgeously sexy as hell beautiful,neg
What A Pair Of ? Puppies, Tats, Hips & Thighs?!,neg
Wow! Big ?Hooters? & Paradise Found!,neg
Fuck u Babe,neg
I Love This Girl because I Fuck u,neg
bitch thats what you are,neg
Legs are good ,breast good,laps good,hips good,even their vagina will be good,neg
I wish i can fuck the two of you at ones.,neg
Two Hot Tarts,neg
Hips Thighs & Puppies,neg
Hot sexy beautiful girls,neg
Nice boobs,neg
Love this booty fuck,neg
Wow nice picture . Please can I lick your  pussy,neg
So sweet boobs and nice booty I love so sweet and nice baby,neg
Baby you are very beautiful and sexy,neg
Next I.wana see your pussy,neg
2 sexy Gand,neg
Beautiful,neg
Miss you,pos
I lick your ass,pos
Wao so nice and lovly body love you princess,neg
Hammering,pos
So beautiful looking and hot hot lady looking for lady ASS your.,neg
Drink boobs,neg
Hi Hot damsels love fitgirls sexygirls cv alvy,neg
Hello pretty Angele I wish u to be my friend,pos
You are beautiful,pos
That's what we call hot,neg
I love your boobs,neg
waaaaaw i love you,pos
Hermosa,pos
Fuck you,neg
Love it,pos
I like lovely face,pos
So sexy and hot looking nice can we make love,neg
Hi I really love your style,pos
youare so beautiful u looking very sexy baby,neg
So beautiful And Lovely gozises,pos
Awesome,pos
I want to saw something interesting,neg
Nice sexy hips and thighs from the side you look great,neg
i like it..,pos
